{
  "schema": "goalos.model-catalog.v1",
  "catalogId": "goalos-office-model-catalog-2026-07-26",
  "product": "GoalOS Singularity Office Ω",
  "release": "v2.0.0-SO2",
  "issuedAt": "2026-07-27T09:00:00-04:00",
  "models": [
    {
      "id": "local-deterministic",
      "name": "GoalOS Local Deterministic Council",
      "provider": "MONTREAL.AI",
      "class": "browser-local",
      "privacy": 100,
      "evidence": 88,
      "reasoning": 72,
      "speed": 96,
      "cost": 100,
      "tooling": 60,
      "resilience": 95,
      "status": "available"
    },
    {
      "id": "protected-frontier",
      "name": "Protected Frontier Model Pool",
      "provider": "Protected Runtime",
      "class": "hosted-frontier",
      "privacy": 72,
      "evidence": 84,
      "reasoning": 96,
      "speed": 83,
      "cost": 62,
      "tooling": 94,
      "resilience": 86,
      "status": "requires-runtime"
    },
    {
      "id": "local-open",
      "name": "Local Open-Weight Sovereign Stack",
      "provider": "Customer Infrastructure",
      "class": "local-model",
      "privacy": 96,
      "evidence": 74,
      "reasoning": 78,
      "speed": 68,
      "cost": 82,
      "tooling": 75,
      "resilience": 92,
      "status": "requires-runtime"
    },
    {
      "id": "expert-augmented",
      "name": "Independent Expert-Augmented Stack",
      "provider": "Professional Network",
      "class": "human-ai",
      "privacy": 82,
      "evidence": 96,
      "reasoning": 90,
      "speed": 52,
      "cost": 38,
      "tooling": 70,
      "resilience": 95,
      "status": "professional-authority"
    },
    {
      "id": "high-throughput",
      "name": "High-Throughput Hybrid Stack",
      "provider": "Multi-Provider",
      "class": "hybrid",
      "privacy": 64,
      "evidence": 80,
      "reasoning": 84,
      "speed": 94,
      "cost": 78,
      "tooling": 90,
      "resilience": 88,
      "status": "requires-runtime"
    },
    {
      "id": "research-sandbox",
      "name": "Isolated Research Sandbox Stack",
      "provider": "Customer / Partner",
      "class": "sandbox",
      "privacy": 94,
      "evidence": 92,
      "reasoning": 88,
      "speed": 58,
      "cost": 55,
      "tooling": 96,
      "resilience": 90,
      "status": "requires-runtime"
    }
  ],
  "signature": "3kSQhcZARNVMNkccKu6EX6V8U_2-TQPsP6D4EpR8qLxer1_Xw0Aj-RBRU-aIirfOIvUQQJCBeTA9IX18VNkzdA",
  "signatureAlgorithm": "ECDSA-P256-SHA256",
  "publicKeyId": "goalos-office-publisher-2026-01"
}
